{
 "schema_version": "sleepintel-hypothesis.v1",
 "hypothesis_id": "H-C-COVERS",
 "version": 1,
 "statement": "Sleepy Covers wins: most clickable premise (songs you love, asleep) with novelty front-loaded and piano back-filling paid hours.",
 "mechanism": "Talking-head intro is the only novel cost; rendition plays for hours; claims-not-strikes math holds.",
 "status": "draft",
 "parent_hypothesis_ids": [
  "H-PLACE",
  "H-HOST"
 ],
 "channel_ids": [
  37
 ],
 "engine_ids": [
  "E1"
 ],
 "predictions": [
  {
   "id": "H-C-COVERS-P1",
   "claim": "CTR top-quartile of network on pilot",
   "metric": "ctr_quartile",
   "threshold": "<=Q1",
   "window_days": 30
  }
 ],
 "created_at": "2026-09-26"
}