{
 "schema_version": "sleepintel-hypothesis.v1",
 "version": 1,
 "status": "probation",
 "created_at": "2026-09-26",
 "hypothesis_id": "H-NO-ADVERTS",
 "statement": "Friction-removal flags (no adverts, no interruptions) lift CTR in music/ambience.",
 "mechanism": "Sleepers fear being woken; the flag is insurance.",
 "parent_hypothesis_ids": [
  "H-HOST"
 ],
 "channel_ids": [
  34
 ],
 "engine_ids": [
  "E1"
 ],
 "predictions": [
  {
   "id": "H-NO-ADVERTS-P1",
   "claim": "flagged titles beat unflagged twins on CTR",
   "metric": "ctr_vs_sibling",
   "threshold": ">1.0x",
   "window_days": 30
  }
 ]
}