{
 "schema_version": "sleepintel-hypothesis.v1",
 "hypothesis_id": "H-PLACE",
 "version": 1,
 "statement": "Nobody clicks 'for sleep'; they click where they want to feel like they are. Sleep is how they consume; place is why they click.",
 "mechanism": "Curiosity selects the video; habitation (a room, century, world, proof) removes the need to keep watching, which is what sleep requires.",
 "status": "active",
 "parent_hypothesis_ids": [],
 "channel_ids": [
  1,
  2,
  3,
  4,
  5,
  6,
  7,
  8,
  9,
  10,
  11,
  12,
  13,
  14,
  15,
  16,
  17,
  18,
  19,
  20,
  21,
  22,
  23,
  24,
  25,
  26,
  27,
  28,
  29,
  30,
  31,
  32,
  33,
  34,
  35,
  36,
  37,
  38,
  39,
  40,
  41,
  42,
  43,
  44,
  45,
  46,
  47,
  48,
  49,
  50,
  51,
  52,
  53,
  54,
  55,
  56
 ],
 "engine_ids": [],
 "predictions": [
  {
   "id": "H-PLACE-P1",
   "claim": "place-framed titles beat topic-framed twins on CTR",
   "metric": "ctr_vs_sibling_median",
   "threshold": ">1.0x",
   "window_days": 30
  }
 ],
 "created_at": "2026-09-26"
}