{
 "schema_version": "sleepintel-hypothesis.v1",
 "hypothesis_id": "H-C-ALBUM",
 "version": 1,
 "statement": "Composer Evenings wins: ritual (same intro, same goodnight) + owned recordings + wedge branding.",
 "mechanism": "Evening grammar turns music into appointment viewing; owned piano removes rights risk entirely.",
 "status": "probation",
 "parent_hypothesis_ids": [
  "H-HOST"
 ],
 "channel_ids": [
  34
 ],
 "engine_ids": [
  "E1"
 ],
 "predictions": [
  {
   "id": "H-C-ALBUM-P1",
   "claim": "return-viewer rate above network median by episode 4",
   "metric": "return_rate",
   "threshold": ">median",
   "window_days": 60
  }
 ],
 "created_at": "2026-09-26"
}