{
 "schema_version": "sleepintel-hypothesis.v1",
 "version": 1,
 "status": "probation",
 "created_at": "2026-09-26",
 "hypothesis_id": "H-PLACE-TITLE",
 "statement": "Place-titles (in X, inside Y) beat abstract titles within story channels.",
 "mechanism": "Habitation curiosity: a named place pre-loads the dream.",
 "parent_hypothesis_ids": [
  "H-PLACE"
 ],
 "channel_ids": [
  29
 ],
 "engine_ids": [
  "E5"
 ],
 "predictions": [
  {
   "id": "H-PLACE-TITLE-P1",
   "claim": "place-title pilots beat abstract twins on CTR",
   "metric": "ctr_vs_sibling",
   "threshold": ">1.0x",
   "window_days": 30
  }
 ]
}