{
 "schema_version": "sleepintel-hypothesis.v1",
 "hypothesis_id": "H-HARD",
 "version": 1,
 "statement": "Difficulty is a lullaby: dense papers/theory sleep people because tracking-load near zero, not because content is simple.",
 "mechanism": "Interesting enough to choose (curiosity), forgiving enough to drift from (no plot to lose).",
 "status": "active",
 "parent_hypothesis_ids": [],
 "channel_ids": [],
 "engine_ids": [
  "E5"
 ],
 "predictions": [
  {
   "id": "H-HARD-P1",
   "claim": "hard-paper episodes match network retention medians or better",
   "metric": "avd_vs_network_median",
   "threshold": ">=1.0x",
   "window_days": 30
  }
 ],
 "created_at": "2026-09-26"
}