{
 "schema_version": "sleepintel-hypothesis.v1",
 "hypothesis_id": "H-HOST",
 "version": 1,
 "statement": "Hosted sleep (one voice, one goodnight, irregular soft check-ins) retains better than abandoned sleep.",
 "mechanism": "Recognition + ritual + unpredictable gentle re-anchors give permission to let go; metronomic patterns train anticipation (wakefulness).",
 "status": "active",
 "parent_hypothesis_ids": [],
 "channel_ids": [],
 "engine_ids": [
  "E1"
 ],
 "predictions": [
  {
   "id": "H-HOST-P1",
   "claim": "hosted episodes hold past 25% more often than unhosted twins",
   "metric": "avd25_rate_vs_control",
   "threshold": ">1.0x",
   "window_days": 30
  }
 ],
 "created_at": "2026-09-26"
}