{
 "schema_version": "sleepintel-hypothesis.v1",
 "version": 1,
 "status": "probation",
 "created_at": "2026-09-26",
 "hypothesis_id": "H-COUNT-FORMAT",
 "statement": "Counted formats (100 X, entire Y, night N of M) outperform uncounted twins.",
 "mechanism": "Completionism + visible finish line.",
 "parent_hypothesis_ids": [
  "H-PLACE"
 ],
 "channel_ids": [
  72,
  123
 ],
 "engine_ids": [
  "E5"
 ],
 "predictions": [
  {
   "id": "H-COUNT-FORMAT-P1",
   "claim": "17/58 competitor density replicates in our pilots",
   "metric": "ctr_vs_median",
   "threshold": ">1.0x",
   "window_days": 30
  }
 ]
}