{
 "schema_version": "sleepintel-hypothesis.v1",
 "hypothesis_id": "H-C-SINGULARITY",
 "version": 1,
 "statement": "Quiet Singularity wins: topic of the decade + black-screen-viable cheapest pipeline.",
 "mechanism": "AI Explained demand without sleep form; no visuals needed (content IS narration).",
 "status": "draft",
 "parent_hypothesis_ids": [
  "H-HARD"
 ],
 "channel_ids": [
  38
 ],
 "engine_ids": [
  "E5"
 ],
 "predictions": [
  {
   "id": "H-C-SINGULARITY-P1",
   "claim": "pilot CTR above network median on topic strength alone",
   "metric": "ctr_vs_median",
   "threshold": ">1.0x",
   "window_days": 14
  }
 ],
 "created_at": "2026-09-26"
}