{
 "schema_version": "sleepintel-hypothesis.v1",
 "hypothesis_id": "H-C-HARD",
 "version": 1,
 "statement": "Hard Sleep wins: dual audience (sleepers + intimidated learners), corpus graded and held.",
 "mechanism": "Bub precedent (1.98M calculus); papers are free scripts; whiteboard hand is the host.",
 "status": "draft",
 "parent_hypothesis_ids": [
  "H-HARD"
 ],
 "channel_ids": [
  27,
  6
 ],
 "engine_ids": [
  "E5"
 ],
 "predictions": [
  {
   "id": "H-C-HARD-P1",
   "claim": "comments show study-use alongside sleep-use",
   "metric": "study_comment_share",
   "threshold": ">10%",
   "window_days": 60
  }
 ],
 "created_at": "2026-09-26"
}