{
 "schema_version": "sleepintel-hypothesis.v1",
 "hypothesis_id": "H-C-RAIN",
 "version": 1,
 "statement": "Rain in Weird Places wins: one bed, N skins; sleep + study + work audiences in one.",
 "mechanism": "Cheapest engine per episode; autocomplete-confirmed demand; leave-it-on format.",
 "status": "draft",
 "parent_hypothesis_ids": [
  "H-PLACE"
 ],
 "channel_ids": [],
 "engine_ids": [
  "E4"
 ],
 "predictions": [
  {
   "id": "H-C-RAIN-P1",
   "claim": "non-sleep watch share (study/work comments) above 15%",
   "metric": "daytime_share",
   "threshold": ">15%",
   "window_days": 60
  }
 ],
 "created_at": "2026-09-26"
}