{
 "schema_version": "sleepintel-hypothesis.v1",
 "hypothesis_id": "H-C-HERE",
 "version": 1,
 "statement": "Fall Asleep Here wins: era+place+journey beats franchise 20x with zero rights thread.",
 "mechanism": "'Sleep in a ___' grammar owned; the room is written, therefore ours.",
 "status": "draft",
 "parent_hypothesis_ids": [
  "H-PLACE"
 ],
 "channel_ids": [],
 "engine_ids": [
  "E5"
 ],
 "predictions": [
  {
   "id": "H-C-HERE-P1",
   "claim": "scenario pilots beat franchise-lore pilots on views/day",
   "metric": "views_per_day_ratio",
   "threshold": ">5x",
   "window_days": 30
  }
 ],
 "created_at": "2026-09-26"
}