{
 "schema_version": "sleepintel-hypothesis.v1",
 "hypothesis_id": "H-ENGINES",
 "version": 1,
 "statement": "Six engines serve fifty-six channels; a channel is corpus + accent + flavor on a shared engine. No engine is built for one channel.",
 "mechanism": "Production cost amortizes across expressions; new channels cost a brief + a pilot, not a pipeline.",
 "status": "active",
 "parent_hypothesis_ids": [],
 "channel_ids": [],
 "engine_ids": [],
 "predictions": [
  {
   "id": "H-ENGINES-P1",
   "claim": "pilot cost stays under 2h operator time on built engines",
   "metric": "operator_minutes_per_pilot",
   "threshold": "<=120",
   "window_days": 30
  }
 ],
 "created_at": "2026-09-26"
}